{
  "meta": {
    "generated_at": "2026-10-26T13:21:07Z",
    "schema_version": "1.0.0",
    "latest_snapshot_date": "2026-10-26",
    "total_tracked_companies": 818,
    "sp500_tracked_companies": 508
  },
  "market_vitality": {
    "total_ai_data_jobs": 5686,
    "total_open_jobs_pool": 461606,
    "overall_ai_intensity_pct": 1.23,
    "sp500_ai_data_jobs": 4307,
    "sp500_open_jobs_pool": 413801,
    "sp500_ai_intensity_pct": 1.04,
    "sp500_hiring_companies": 475,
    "sp500_zero_job_companies": 33,
    "cz_ai_data_jobs": 176,
    "eu_uk_ch_ai_data_jobs": 790,
    "us_ca_ai_data_jobs": 4896,
    "top_hiring_companies": [
      {
        "company_id": "te_connectivity",
        "company_name": "TE Connectivity",
        "is_sp500": true,
        "sector": "Information Technology",
        "ai_data_jobs": 210,
        "total_active_jobs": 2283,
        "ai_intensity_pct": 9.2
      },
      {
        "company_id": "unitedhealth_group",
        "company_name": "UnitedHealth Group",
        "is_sp500": true,
        "sector": "Health Care",
        "ai_data_jobs": 202,
        "total_active_jobs": 1200,
        "ai_intensity_pct": 16.83
      },
      {
        "company_id": "databricks",
        "company_name": "Databricks",
        "is_sp500": false,
        "sector": null,
        "ai_data_jobs": 183,
        "total_active_jobs": 5634,
        "ai_intensity_pct": 3.25
      },
      {
        "company_id": "openai",
        "company_name": "OpenAI",
        "is_sp500": false,
        "sector": null,
        "ai_data_jobs": 182,
        "total_active_jobs": 4323,
        "ai_intensity_pct": 4.21
      },
      {
        "company_id": "alphabet_class_c",
        "company_name": "Alphabet Inc. (Class C)",
        "is_sp500": true,
        "sector": "Communication Services",
        "ai_data_jobs": 132,
        "total_active_jobs": 3458,
        "ai_intensity_pct": 3.82
      },
      {
        "company_id": "alphabet_class_a",
        "company_name": "Alphabet Inc. (Class A)",
        "is_sp500": true,
        "sector": "Communication Services",
        "ai_data_jobs": 132,
        "total_active_jobs": 3458,
        "ai_intensity_pct": 3.82
      },
      {
        "company_id": "alphabet",
        "company_name": "Google (Alphabet)",
        "is_sp500": true,
        "sector": "Communication Services",
        "ai_data_jobs": 132,
        "total_active_jobs": 3458,
        "ai_intensity_pct": 3.82
      },
      {
        "company_id": "anthropic",
        "company_name": "Anthropic",
        "is_sp500": false,
        "sector": null,
        "ai_data_jobs": 129,
        "total_active_jobs": 3476,
        "ai_intensity_pct": 3.71
      },
      {
        "company_id": "amazon",
        "company_name": "Amazon",
        "is_sp500": true,
        "sector": "Consumer Discretionary",
        "ai_data_jobs": 73,
        "total_active_jobs": 10000,
        "ai_intensity_pct": 0.73
      },
      {
        "company_id": "amgen",
        "company_name": "Amgen",
        "is_sp500": true,
        "sector": "Health Care",
        "ai_data_jobs": 69,
        "total_active_jobs": 1763,
        "ai_intensity_pct": 3.91
      },
      {
        "company_id": "arthur_j_gallagher_co",
        "company_name": "Arthur J. Gallagher & Co.",
        "is_sp500": true,
        "sector": "Financials",
        "ai_data_jobs": 57,
        "total_active_jobs": 1245,
        "ai_intensity_pct": 4.58
      },
      {
        "company_id": "citigroup",
        "company_name": "Citigroup",
        "is_sp500": true,
        "sector": "Financials",
        "ai_data_jobs": 56,
        "total_active_jobs": 2000,
        "ai_intensity_pct": 2.8
      },
      {
        "company_id": "snowflake",
        "company_name": "Snowflake",
        "is_sp500": false,
        "sector": null,
        "ai_data_jobs": 52,
        "total_active_jobs": 1974,
        "ai_intensity_pct": 2.63
      },
      {
        "company_id": "advanced_micro_devices",
        "company_name": "Advanced Micro Devices",
        "is_sp500": true,
        "sector": "Information Technology",
        "ai_data_jobs": 51,
        "total_active_jobs": 1264,
        "ai_intensity_pct": 4.03
      },
      {
        "company_id": "general_motors",
        "company_name": "General Motors",
        "is_sp500": true,
        "sector": "Consumer Discretionary",
        "ai_data_jobs": 46,
        "total_active_jobs": 770,
        "ai_intensity_pct": 5.97
      }
    ],
    "regional_breakdown": [
      {
        "country_code": "US",
        "country_name": "United States",
        "region": "Americas",
        "job_count": 4278,
        "share_pct": 75.24
      },
      {
        "country_code": "CA",
        "country_name": "Canada",
        "region": "Americas",
        "job_count": 618,
        "share_pct": 10.87
      },
      {
        "country_code": "UK",
        "country_name": "United Kingdom",
        "region": "UK",
        "job_count": 229,
        "share_pct": 4.03
      },
      {
        "country_code": "CZ",
        "country_name": "Czech Republic",
        "region": "EU",
        "job_count": 176,
        "share_pct": 3.1
      },
      {
        "country_code": "DE",
        "country_name": "Germany",
        "region": "EU",
        "job_count": 139,
        "share_pct": 2.44
      },
      {
        "country_code": "PL",
        "country_name": "Poland",
        "region": "EU",
        "job_count": 52,
        "share_pct": 0.91
      },
      {
        "country_code": "ES",
        "country_name": "Spain",
        "region": "EU",
        "job_count": 43,
        "share_pct": 0.76
      },
      {
        "country_code": "IE",
        "country_name": "Ireland",
        "region": "EU",
        "job_count": 37,
        "share_pct": 0.65
      },
      {
        "country_code": "FR",
        "country_name": "France",
        "region": "EU",
        "job_count": 30,
        "share_pct": 0.53
      },
      {
        "country_code": "NL",
        "country_name": "Netherlands",
        "region": "EU",
        "job_count": 19,
        "share_pct": 0.33
      },
      {
        "country_code": "CH",
        "country_name": "Switzerland",
        "region": "Europe Non-EU",
        "job_count": 15,
        "share_pct": 0.26
      },
      {
        "country_code": "IT",
        "country_name": "Italy",
        "region": "EU",
        "job_count": 10,
        "share_pct": 0.18
      }
    ]
  },
  "tech_cloud_stack": {
    "hyperscalers": [
      {
        "skill_id": "aws",
        "skill_name": "AWS",
        "category": "Cloud",
        "job_count": 758,
        "penetration_pct": 13.33
      },
      {
        "skill_id": "azure",
        "skill_name": "Microsoft Azure",
        "category": "Cloud",
        "job_count": 666,
        "penetration_pct": 11.71
      },
      {
        "skill_id": "gcp",
        "skill_name": "Google Cloud Platform",
        "category": "Cloud",
        "job_count": 512,
        "penetration_pct": 9.0
      }
    ],
    "data_platforms": [
      {
        "skill_id": "databricks",
        "skill_name": "Databricks",
        "category": "Cloud",
        "job_count": 541,
        "penetration_pct": 9.51
      },
      {
        "skill_id": "snowflake_db",
        "skill_name": "Snowflake",
        "category": "Cloud",
        "job_count": 315,
        "penetration_pct": 5.54
      },
      {
        "skill_id": "bigquery",
        "skill_name": "BigQuery",
        "category": "Cloud",
        "job_count": 100,
        "penetration_pct": 1.76
      },
      {
        "skill_id": "redshift",
        "skill_name": "Amazon Redshift",
        "category": "Cloud",
        "job_count": 55,
        "penetration_pct": 0.97
      },
      {
        "skill_id": "ms_fabric",
        "skill_name": "Microsoft Fabric",
        "category": "Cloud",
        "job_count": 33,
        "penetration_pct": 0.58
      },
      {
        "skill_id": "duckdb",
        "skill_name": "DuckDB",
        "category": "Database",
        "job_count": 5,
        "penetration_pct": 0.09
      }
    ],
    "top_technologies": [
      {
        "skill_id": "python",
        "skill_name": "Python",
        "category": "Programming",
        "job_count": 2059,
        "penetration_pct": 36.21
      },
      {
        "skill_id": "sql",
        "skill_name": "SQL",
        "category": "Programming",
        "job_count": 1271,
        "penetration_pct": 22.35
      },
      {
        "skill_id": "llm",
        "skill_name": "LLM / Large Language Models",
        "category": "AI/ML",
        "job_count": 1090,
        "penetration_pct": 19.17
      },
      {
        "skill_id": "ai_agents",
        "skill_name": "AI Agents / Agentic AI",
        "category": "AI/ML",
        "job_count": 1062,
        "penetration_pct": 18.68
      },
      {
        "skill_id": "genai",
        "skill_name": "GenAI / Generative AI",
        "category": "AI/ML",
        "job_count": 829,
        "penetration_pct": 14.58
      },
      {
        "skill_id": "aws",
        "skill_name": "AWS",
        "category": "Cloud",
        "job_count": 758,
        "penetration_pct": 13.33
      },
      {
        "skill_id": "azure",
        "skill_name": "Microsoft Azure",
        "category": "Cloud",
        "job_count": 666,
        "penetration_pct": 11.71
      },
      {
        "skill_id": "data_governance",
        "skill_name": "Data Governance & Quality",
        "category": "Business",
        "job_count": 660,
        "penetration_pct": 11.61
      },
      {
        "skill_id": "spark",
        "skill_name": "Apache Spark",
        "category": "Framework",
        "job_count": 626,
        "penetration_pct": 11.01
      },
      {
        "skill_id": "evals_observability",
        "skill_name": "MLOps / Evals & Observability",
        "category": "MLOps",
        "job_count": 624,
        "penetration_pct": 10.97
      },
      {
        "skill_id": "databricks",
        "skill_name": "Databricks",